smartctl 7.1 2019-12-30 r5022 [x86_64-w64-mingw32-win7-sp1] (sf-7.1-1)
Copyright (C) 2002-19, Bruce Allen, Christian Franke, www.smartmontools.org

=== START OF INFORMATION SECTION ===
Model Family:     Phison Driven OEM SSDs
Device Model:     SPCC Solid State Disk
Serial Number:    FECA074119EC00135467
Firmware Version: S8FM06.9
User Capacity:    120 034 123 776 bytes [120 GB]
Sector Size:      512 bytes logical/physical
Rotation Rate:    Solid State Device
Form Factor:      2.5 inches
Device is:        In smartctl database [for details use: -P show]
ATA Version is:   ATA8-ACS (minor revision not indicated)
SATA Version is:  SATA 3.1, 6.0 Gb/s (current: 3.0 Gb/s)
Local Time is:    Sun Apr 12 18:00:05 2020 
SMART support is: Available - device has SMART capability.
SMART support is: Enabled

=== START OF ENABLE/DISABLE COMMANDS SECTION ===
SMART Enabled.

=== START OF READ SMART DATA SECTION ===
SMART overall-health self-assessment test result: PASSED

General SMART Values:
Offline data collection status:  (0x00)	Offline data collection activity
					was never started.
					Auto Offline Data Collection: Disabled.
Self-test execution status:      (   0)	The previous self-test routine completed
					without error or no self-test has ever 
					been run.
Total time to complete Offline 
data collection: 		(  255) seconds.
Offline data collection
capabilities: 			 (0x1b) SMART execute Offline immediate.
					Auto Offline data collection on/off support.
					Suspend Offline collection upon new
					command.
					Offline surface scan supported.
					Self-test supported.
					No Conveyance Self-test supported.
					No Selective Self-test supported.
SMART capabilities:            (0x0003)	Saves SMART data before entering
					power-saving mode.
					Supports SMART auto save timer.
Error logging capability:        (0x01)	Error logging supported.
					General Purpose Logging supported.
Short self-test routine 
recommended polling time: 	 (   1) minutes.
Extended self-test routine
recommended polling time: 	 (   2) minutes.

SMART Attributes Data Structure revision number: 16
Vendor Specific SMART Attributes with Thresholds:
ID# ATTRIBUTE_NAME          FLAG     VALUE WORST THRESH TYPE      UPDATED  WHEN_FAILED RAW_VALUE
  1 Raw_Read_Error_Rate     0x000b   100   100   050    Pre-fail  Always       -       0
  9 Power_On_Hours          0x0012   100   100   000    Old_age   Always       -       7991
 12 Power_Cycle_Count       0x0012   100   100   000    Old_age   Always       -       1579
168 SATA_Phy_Error_Count    0x0012   100   100   000    Old_age   Always       -       2
170 Bad_Blk_Ct_Erl/Lat      0x0003   100   100   010    Pre-fail  Always       -       0/162
173 MaxAvgErase_Ct          0x0012   100   100   000    Old_age   Always       -       256 (Average 162)
192 Unsafe_Shutdown_Count   0x0012   100   100   000    Old_age   Always       -       59
218 CRC_Error_Count         0x000b   100   100   050    Pre-fail  Always       -       0
241 Lifetime_Writes_GiB     0x0012   100   100   000    Old_age   Always       -       7462

SMART Error Log Version: 1
No Errors Logged

SMART Self-test log structure revision number 1
Num  Test_Description    Status                  Remaining  LifeTime(hours)  LBA_of_first_error
# 1  Short offline       Completed without error       00%         1         -
# 2  Extended offline    Completed without error       00%         3         -
# 3  Short offline       Completed without error       00%         1         -
# 4  Short offline       Completed without error       00%         1         -
# 5  Extended offline    Completed without error       00%         3         -
# 6  Short offline       Completed without error       00%         1         -
# 7  Short offline       Completed without error       00%         1         -
# 8  Short offline       Completed without error       00%         1         -
# 9  Extended offline    Completed without error       00%         3         -
#10  Short offline       Completed without error       00%         1         -
#11  Short offline       Completed without error       00%         1         -
#12  Extended offline    Completed without error       00%        69         -
#13  Short offline       Completed without error       00%        67         -
#14  Short offline       Completed without error       00%        45         -
#15  Short offline       Completed without error       00%        23         -
#16  Short offline       Completed without error       00%         1         -
#17  Short offline       Completed without error       00%         1         -
#18  Extended offline    Completed without error       00%         3         -
#19  Short offline       Completed without error       00%         1         -
#20  Short offline       Completed without error       00%         1         -
#21  Extended offline    Completed without error       00%         3         -

Selective Self-tests/Logging not supported

